{
  "formatVersion": 1,
  "pluginVersion": "1.1.0",
  "apiVersion": "1.0",
  "files": [
    { "path": "core/contracts/cli-contract.json", "role": "cli", "sha256": "083cc8d1e246c0db17f3b37791d292c1c202e869425b3299ccf90715bf4723e5" },
    { "path": "core/contracts/cli-contract.schema.json", "role": "cli", "sha256": "2686085e2af99f3c9edb5403f5ca2c73a13e50ddf942c91cc99c31092cdb50a6" },
    { "path": "plugin.json", "role": "configuration", "sha256": "f99a54092d749ae212a7deedab67ca127bed2c74ad39966bb546f53209606e7f" },
    { "path": "core/contracts/extension-bundle.schema.json", "role": "configuration", "sha256": "c58b732a148e97f8100ffd887ff31b9f05ef36634b31532f5f8a349da2d19051" },
    { "path": "core/contracts/extension-review.schema.json", "role": "configuration", "sha256": "61706ab67aab616b5f4eee7076bedb8f0057f955db9483161f83c0bf16a369b7" },
    { "path": "core/contracts/composition-manifest.schema.json", "role": "report", "sha256": "8061de689ee8a3126ab6ef9e8d4604d9ee988462a451119fed5415a459e04bde" },
    { "path": "core/contracts/composition-receipt.schema.json", "role": "report", "sha256": "3c38682480287bcbd7fbfe71c812601058a54c0b65499076cf56ebfd48f72f0a" },
    { "path": "core/contracts/plugin.schema.json", "role": "configuration", "sha256": "0c7d3a626aa7d37dc0c1a6314b15f8b72cc70d42feb143a8e85994f266249a0f" },
    { "path": "core/contracts/profile.schema.json", "role": "configuration", "sha256": "35f42988d4a5ed2ee6d807a089a4d158a878cc96456489012400c08e0c4007a2" },
    { "path": "core/contracts/workspace-evidence.schema.json", "role": "report", "sha256": "bbed8f4019aea8400391ea4c21bb78ae537664ef3c3e5f8b06146c1fe5f892a8" },
    { "path": "core/contracts/module.schema.json", "role": "configuration", "sha256": "78e24ceb7b7716f893602cf163e055033dab1872d171a9bc89fdd50c7413bfd7" },
    { "path": "core/contracts/module-registry.schema.json", "role": "configuration", "sha256": "4b9532bc83552b28826cab24e77e1e8d683c69e57d17828f7e68f5271a08d16b" },
    { "path": "core/contracts/runtime-requirements.schema.json", "role": "configuration", "sha256": "9af23fe5469cc2ec73b4e65992d83a5e637b7cbf291b7ede685b79154f2ba4b7" },
    { "path": "core/contracts/stage-result.schema.json", "role": "report", "sha256": "6f2df2a330dd19fd39636f3adbe4c076974435694bb13eab7b62a7a445815e3b" },
    { "path": "core/contracts/state.schema.json", "role": "report", "sha256": "0ec1c8f29c266c7b38f4ca49b1b57c4143266563164bbb497362fddf9dfc9dc9" },
    { "path": "core/contracts/reset-manifest.schema.json", "role": "report", "sha256": "1d875f89e6375eaf0c8274724905fc8ce3bfe4f309d6c2017edfdfbe90a16134" },
    { "path": "core/contracts/prerequisite-report.schema.json", "role": "report", "sha256": "b5bd9dfa40fcd85abd8410321f572e858444b8087b83caf0715eab33edbc630a" },
    { "path": "core/contracts/distribution-manifest.schema.json", "role": "report", "sha256": "2663f64d18799bc5de645130d1b591ecc747a8620e12c67cdc6fdc8261facb74" },
    { "path": "core/contracts/plan.schema.json", "role": "configuration", "sha256": "86aec6ec2f778f1c3f7d193634b6731fa7fbf73bcb9a804f9514a990bd967dbc" },
    { "path": "core/contracts/plan-set.schema.json", "role": "configuration", "sha256": "b29456e3ca35da162a863747380d7cfedc001c93803d504572ccfb73818cc26e" },
    { "path": "core/contracts/platform-certification.schema.json", "role": "report", "sha256": "dbf597cce6fe65187eda2daece10109576a6e12eca20dfbb1ce254335ac7f92d" },
    { "path": "core/contracts/v1-certification.schema.json", "role": "report", "sha256": "d42f4187d6f4e128d7684538eff996f1161c3936a4189f705860557fe9b44ac3" },
    { "path": "core/contracts/recovery-artifact.schema.json", "role": "report", "sha256": "e2ea5fa1d3878f7e921f9d6ba3057fcd206fde082e96684d228f3cd0d6d7a0a2" }
  ]
}
